rating,comment
1,I really enjoyed the course! The content was engaging and the instructor was knowledgeable.
0,"The class was average. Some parts were interesting, but others were a bit confusing."
-1,This course was a waste of time. The material was poorly presented and I didn't learn much.
1,The professor was excellent and made the subject matter come to life.
0,"I have mixed feelings about this class. Some topics were great, but overall it was just okay."
1,I'm so glad I took this course. It exceeded my expectations and I learned a lot.
-1,I regret enrolling in this class. It was disorganized and the assignments were unclear.
0,The course content was dry and unengaging. I struggled to stay focused during lectures.
1,"The projects were challenging, but they helped me grow and improve my skills."
-1,I found this course to be frustrating and unhelpful. I wouldn't recommend it to others.
-1,The instructor seemed disinterested in teaching. I didn't feel motivated to participate.
1,"The course structure was well-designed, and the interactive activities were enjoyable."
-1,I was disappointed by the lack of real-world applications in this course.
1,The guest speakers brought valuable insights and real-world experience to the lectures.
0,I wish there were more opportunities for hands-on practice in this class.
1,I feel much more confident in the subject after completing this course.
-1,"The course materials were outdated, and the assessments didn't align with the content."
0,I expected more from this class. It didn't meet my expectations.
1,The group projects were a great way to collaborate and learn from peers.
0,"The workload was manageable, but some assignments felt repetitive."
1,I would recommend this course to anyone interested in the subject.
-1,"The course was disorganized, and the schedule kept changing without notice."
0,"The readings were interesting, but the lectures didn't add much value."
1,I'm grateful for the insights I gained from taking this course.
-1,I found the grading criteria to be unclear and inconsistent.
0,"The course was just okay. It didn't stand out, but it wasn't terrible either."
1,The instructor's passion for the subject was evident and made the class enjoyable.
-1,I struggled to stay engaged during the lectures. The material wasn't presented well.
0,"The class discussions were thought-provoking, but the assessments were confusing."
1,I'm impressed by how much I learned in such a short period. The course was intense but rewarding.
-1,I wish the course had covered more practical skills instead of focusing on theory.
0,The course was forgettable. I didn't gain much from it.
1,I'm amazed by how much my perspective has changed after taking this course.
-1,The course was a disappointment. The content felt outdated and irrelevant.
0,"The workload was reasonable, but the assignments lacked clarity."
1,The course exceeded my expectations. The projects were challenging but fulfilling.
-1,I didn't feel supported by the instructor throughout the course.
0,"The course content had potential, but it was poorly executed."
1,I enjoyed the hands-on labs and the opportunities for practical application.
-1,"The course materials were confusing, and the assessments were unfair."
0,The course was average. It didn't leave a strong impression on me.
1,I'm grateful for the valuable knowledge I gained from this course.
-1,"The course structure was unclear, and the instructions were vague."
0,"The class discussions were interesting, but the readings were dense."
1,I would highly recommend this course to others.
0,"The lectures were monotonous, and the assignments were tedious."
1,The interactive quizzes helped me gauge my understanding of the material.
-1,"I had high hopes for this course, but it fell short of expectations."
0,"The class presentations were informative, but the textbook was confusing."
1,I found the practical examples in the course to be very beneficial.
-1,The course lacked real-world relevance and practical applications.
0,"The course materials were disorganized, and the workload was heavy."
1,The instructor was engaging and made the course material interesting.
-1,The course was a letdown. The topics were disjointed and poorly explained.
0,"The class discussions were engaging, but the assessments were challenging."
1,I would definitely recommend this course to my peers.
0,"The course was decent, but I was hoping for more hands-on activities."
1,The assignments were thought-provoking and encouraged critical thinking.
-1,I found the course content to be too basic for my level of expertise.
0,"The lectures were informative, but the exams were too difficult."
1,The group projects helped me improve my teamwork and collaboration skills.
-1,"The course structure was confusing, and the pacing was inconsistent."
0,"The readings were relevant, but the class discussions were lackluster."
1,The practical exercises were engaging and helped solidify my understanding.
-1,I struggled to connect with the course material and lost interest.
0,The instructor's teaching style didn't resonate with my learning preferences.
1,I'm impressed by the variety of topics covered in this course.
-1,"The assignments were unclear, and I felt lost throughout the course."
0,"The course content was hit or miss. Some topics were interesting, but others were not."
1,The course exceeded my expectations. I gained valuable insights and knowledge.
-1,I found the course to be disorganized and lacking structure.
0,"The course was satisfactory, but I expected more practical exercises."
1,I'm grateful for the engaging discussions and interactive learning experiences.
-1,"The assessments were too challenging, and the course felt overwhelming."
0,"The course materials were outdated, and the content was difficult to follow."
1,I thoroughly enjoyed the guest lectures and the diverse perspectives they offered.
-1,"The course failed to keep me engaged, and I struggled to focus."
0,"The course was average. It didn't stand out, but it wasn't terrible either."
1,The instructor's enthusiasm made the course enjoyable and engaging.
0,"The course content was dry, and I found it difficult to stay engaged."
1,The group projects were valuable learning opportunities.
-1,"The course was disorganized, and the assignments were confusing."
0,"The course was mediocre, and I didn't feel challenged."
1,The interactive activities were a highlight of the course.
-1,"I struggled to understand the material, and the assessments were unfair."
0,"The course was decent, but I expected more hands-on activities."
1,The instructor was knowledgeable and made the subject matter interesting.
-1,I was frustrated by the lack of clear instructions and guidance.
0,"The course content was interesting, but the assignments were too time-consuming."
1,The practical projects were a valuable part of the learning experience.
-1,"The course was poorly structured, and I had trouble following along."
0,"The class discussions were thought-provoking, but the assessments were challenging."
1,I'm grateful for the practical skills I gained from this course.
0,"The workload was manageable, but the assignments lacked clarity."
1,I thoroughly enjoyed the course and found it to be very informative.
-1,"The course materials were confusing, and I struggled to understand the concepts."
0,The course was average. It didn't meet my expectations.
1,"The course exceeded my expectations, and I gained valuable knowledge."
0,"The lectures were monotonous, and the assessments were tedious."
1,The interactive quizzes helped me stay engaged and test my knowledge.
-1,I regret taking this course. The material was poorly explained.
0,"The class was average. Some parts were interesting, but others were not."
1,I'm so glad I enrolled in this course. I learned a lot and enjoyed the experience.
-1,The course was a letdown. The topics were disjointed and confusing.
1,I would definitely recommend this course to others.
-1,"The course content was too basic, and I didn't find it helpful."
0,"The lectures were informative, but the assignments were overwhelming."
1,I found the practical examples in the course to be very valuable.
-1,"The course lacked real-world relevance, and I felt disconnected."
1,"The instructor was engaging, and the course material was interesting."
-1,The course was a disappointment. The topics were not relevant to my needs.
0,"The class discussions were interesting, but the assessments were challenging."
0,"The readings were relevant, but the lectures were uninspiring."
1,"Great subject, really enjoyed the lectures!"
0,"The material was a bit confusing, but I managed."
-1,"Terrible course, didn't learn anything."
1,"Incredible instructor, very engaging."
0,The workload was manageable.
-1,"Worst class ever, a waste of time."
1,I learned so much from this subject!
0,The topics were interesting.
-1,"Couldn't understand anything, frustrating."
1,Highly recommend this course to everyone.
0,"Average subject, nothing special."
-1,I regret taking this class.
1,"Fantastic learning experience, loved every bit of it!"
0,"Some parts were engaging, others were not."
-1,I can't believe I wasted my time on this.
1,The teacher was extremely knowledgeable.
0,The subject matter was relevant.
-1,I struggled to keep up with the pace.
1,I found the assignments to be challenging in a good way.
0,"Overall, it was an okay course."
-1,I can't wait for this class to be over.
1,The class discussions were thought-provoking.
0,The content was presented clearly.
-1,"I had high hopes, but it was disappointing."
1,This course exceeded my expectations.
0,The grading criteria were fair.
-1,I dreaded attending every lecture.
1,I feel more confident in this subject now.
0,The class could have been more interactive.
-1,I didn't gain much from this course.
1,The professor was approachable and helpful.
0,The textbook was well-chosen.
-1,I would not recommend this to anyone.
1,I can see how this subject applies in real life.
0,The assessments were well-structured.
-1,The class atmosphere was not conducive to learning.
1,I enjoyed the group projects.
0,I have mixed feelings about this course.
-1,I wish I had taken a different class.
1,I appreciated the real-world examples.
0,The lectures were sometimes monotonous.
-1,I found the content to be outdated.
1,I was sad when the course ended.
0,The subject matter was important.
-1,The instructor lacked enthusiasm.
1,I would take another course with this professor.
0,The class discussions were helpful.
-1,I couldn't connect with the teaching style.
1,The subject ignited my passion for learning.
0,The syllabus was well-organized.
-1,I barely passed the exams.
1,The hands-on projects were enjoyable.
0,The class was a good use of my time.
-1,I expected more from this course.
1,I was engaged from start to finish.
0,The class was informative.
-1,I didn't feel challenged at all.
1,The assignments were thought-provoking.
0,The class was a bit too fast-paced.
-1,The course materials were disorganized.
1,The subject matter was presented excellently.
0,The course was a required elective.
-1,I regret enrolling in this course.
1,The concepts were explained clearly.
0,The class was average in my opinion.
-1,I struggled to stay interested.
1,I'm grateful for the knowledge gained.
0,The course improved my critical thinking.
-1,I found the assessments to be unfair.
1,I enjoyed the guest speakers.
0,I wish the class had more practical applications.
-1,I didn't like the teaching methods.
1,The course broadened my perspective.
0,The readings were insightful.
-1,The subject was not what I expected.
1,The teacher made the class engaging.
0,The class was well-structured.
-1,I felt lost most of the time.
1,I would recommend this course to others.
-1,The subject matter was too difficult for me.
1,I found the course materials helpful.
0,The class improved my communication skills.
-1,I didn't feel supported in this class.
1,The assignments were relevant and interesting.
0,The class was relevant to my major.
-1,I struggled to find motivation to attend.
1,The instructor encouraged critical thinking.
0,The class was a good balance of theory and practice.
-1,I didn't find the class engaging.
1,The class inspired me to explore further.
0,The subject matter was diverse.
-1,I was disappointed with the curriculum.
1,The course had a positive impact on me.
0,The class had a welcoming atmosphere.
-1,The assignments were too time-consuming.
1,I enjoyed the interactive simulations.
0,The class helped me develop new skills.
-1,I couldn't connect with the subject.
1,The real-world examples were enlightening.
0,The subject matter was intellectually stimulating.
-1,I wish I could get a refund for this class.
1,The course content was enriching and valuable.
0,I had mixed feelings about the subject matter.
-1,I struggled to grasp the concepts.
1,The instructor's passion for the subject was evident.
0,The class discussions were engaging.
-1,I felt overwhelmed by the workload.
1,The practical exercises were insightful.
0,The class assignments were well-structured.
-1,I was bored during most of the lectures.
1,The course improved my problem-solving skills.
0,The subject matter was too abstract for me.
1,The group projects enhanced collaboration.
0,The class helped me refine my analytical thinking.
-1,I found the course material to be outdated.
1,The interactive activities were enjoyable.
0,The class presentation was clear and organized.
-1,The exams were too challenging.
1,The course sparked my interest in the topic.
0,I didn't feel strongly about the subject.
-1,I was disappointed by the lack of practical application.
1,The instructor's real-world experience was valuable.
0,The course met my expectations.
-1,The class structure was confusing.
1,The peer discussions were thought-provoking.
0,The subject was presented in a straightforward manner.
-1,I had difficulty getting help when needed.
1,I enjoyed the open-ended assignments.
0,The course content was diverse and comprehensive.
1,The real-life case studies were eye-opening.
0,The subject was relevant to my field of study.
-1,I felt lost and confused most of the time.
1,The subject was well-researched and informative.
0,The class discussions were intellectually stimulating.
-1,The class structure hindered my learning.
1,The course challenged me to think critically.
0,I didn't connect with the course material.
-1,The lack of practical exercises was disappointing.
1,The instructor's enthusiasm was contagious.
0,The assignments helped reinforce key concepts.
-1,The course didn't meet my expectations.
1,The hands-on labs were enjoyable and educational.
0,The course offered a good balance of theory and practice.
-1,I found the subject matter uninteresting.
1,The real-world examples were relatable and valuable.
0,The course deepened my understanding of the topic.
-1,I struggled to find motivation to study.
1,The guest speakers added value to the class.
0,The class presentations were well-prepared.
-1,I couldn't relate to the content.
1,The course materials were well-organized.
0,The class discussions encouraged critical thinking.
-1,The assessments were overly complex.
1,The class structure facilitated learning.
0,The course broadened my horizons.
-1,I didn't feel engaged during the lectures.
1,The subject matter was intellectually challenging.
0,The instructor was approachable and supportive.
-1,I found the coursework to be overwhelming.
1,The practical examples were enlightening.
0,The subject was presented in an organized manner.
-1,I had difficulty understanding the concepts.
1,The course enhanced my problem-solving abilities.
0,The class provided a solid foundation.
-1,The workload was excessive.
1,The real-world applications were insightful.
0,The class discussions promoted critical analysis.
-1,I was dissatisfied with the course content.
1,The subject matter was thought-provoking.
0,The instructor was knowledgeable and informative.
-1,I didn't feel motivated to attend class.
1,The assignments encouraged creativity.
0,The course met my academic needs.
-1,I struggled to relate to the material.
1,The practical assignments were relevant.
-1,The course structure was confusing.
1,The real-world scenarios were beneficial.
-1,I found the course to be a waste of time.
1,The instructor's expertise was evident.
0,The subject matter was practical and relevant.
-1,I couldn't connect with the teaching approach.
1,The course was a valuable learning experience.
0,The class presentations were well-organized.
-1,I felt overwhelmed by the coursework.
1,The interactive learning activities were effective.
0,The subject was relevant to my future career.
-1,The course content was disorganized.
1,The real-world case studies were valuable.
-1,I struggled to comprehend the material.
1,The hands-on projects were enjoyable and informative.
0,The course provided a solid theoretical foundation.
-1,I found the subject matter to be uninteresting.
1,The instructor was passionate and engaging.
0,The class provided a good overview of the topic.
-1,I didn't find the course engaging.
1,The practical assignments were insightful.
0,The subject was challenging but rewarding.
1,The real-world examples were relevant and informative.
0,The course enhanced my analytical skills.
1,The instructor's teaching style was effective.
0,The class discussions promoted critical thinking.
-1,I struggled to keep up with the coursework.
1,The practical exercises were valuable.
0,The subject was relevant to my academic goals.
-1,I was disappointed by the lack of support.
1,The real-world applications were enlightening.
-1,The assessments were overly challenging.
1,The class structure facilitated my learning.
0,The instructor was knowledgeable and approachable.
1,The practical examples were enlightening and informative.
0,The subject matter was well-structured.
-1,The course content was confusing and poorly explained.
-1,The workload was overwhelming and unreasonable.
-1,The instructor seemed disinterested in teaching.
0,The class discussions were somewhat helpful.
-1,I found the assessments to be unnecessarily difficult.
0,The subject matter was presented in a monotonous manner.
-1,I felt lost throughout most of the lectures.
-1,The course materials were outdated and irrelevant.
0,The assignments were a mix of challenging and manageable.
0,The class lacked engagement and interaction.
-1,The class structure made it difficult to follow.
0,"I had high expectations, but they were not met."
-1,The instructor's explanations were unclear.
0,The class was neither exceptional nor terrible.
0,The subject matter had potential but fell short.
-1,I couldn't find any real-world applications in this.
0,The assessments didn't align well with the lectures.
0,The course didn't leave a strong impression.
-1,The class discussions were repetitive and dull.
0,The subject matter was uninspiring.
-1,The course structure was chaotic and disorganized.
-1,I struggled to connect with the teaching style.
-1,The assignments felt disconnected from the lectures.
-1,The course content was too abstract and theoretical.
0,I had mixed feelings about the class.
-1,I didn't feel supported in my learning journey.
-1,The subject matter was not adequately explained.
-1,The course failed to hold my interest.
0,"The workload was manageable, but unexciting."
0,The class presentations lacked enthusiasm.
-1,The assessments were poorly designed.
-1,I couldn't wait for the course to end.
-1,The instructor's teaching style didn't resonate with me.
-1,I had difficulty finding motivation to study.
-1,The class materials were poorly curated.
-1,The course content lacked depth and insight.
0,The class discussions were hit-or-miss.
-1,I was frustrated by the lack of feedback.
-1,The course felt like a collection of random topics.
0,The subject matter was mediocre at best.
-1,I struggled to see the real-world relevance.
-1,The class was not what I expected at all.
-1,The instructor's explanations were confusing.
-1,The course structure hindered my learning.
-1,I felt disconnected from the class as a whole.
-1,I was disappointed with the lack of practical application.
-1,The subject matter was presented in a convoluted manner.
1,"The course was incredibly enlightening, and the instructor's expertise was evident."
0,"I had mixed feelings about this class. Some parts were engaging, while others were less so."
-1,"This course was a waste of time. The material was poorly organized, and it lacked depth."
1,The professor's passion for the subject matter was contagious.
0,I found this class to be average. It didn't leave a lasting impression.
1,I'm grateful for the valuable insights I gained from this course.
-1,I regret enrolling in this class. It was disorganized and lacked clear objectives.
0,"The course content was uninspiring, and I struggled to stay engaged."
1,The hands-on projects were challenging but rewarding.
-1,I found this course to be frustrating and uninformative. It needs improvement.
0,"The instructor lacked enthusiasm, which made the class less engaging."
1,"The course structure was well thought out, and the assignments were meaningful."
-1,I was disappointed by the lack of practical application in this course.
1,The guest speakers brought a fresh perspective to the subject.
0,I wish there were more opportunities for group work in this class.
1,I feel much more confident in the subject matter after completing this course.
-1,"The course materials were outdated, and the assessments were unclear."
0,I expected more from this class. It fell short of my expectations.
1,"The teamwork in this course was outstanding, and I learned a lot from my peers."
0,"The workload was manageable, but some topics were not well explained."
1,I would recommend this course to anyone interested in the field.
-1,"The course lacked structure, and the timeline was constantly changing."
0,"The readings were engaging, but the lectures were uninspiring."
1,I'm thankful for the valuable knowledge I gained from this course.
-1,"The grading criteria were inconsistent, and it was frustrating."
0,The course was mediocre. It didn't stand out but wasn't terrible either.
1,The instructor's enthusiasm was contagious and made the class enjoyable.
-1,"The lectures were dull, and the material was not presented effectively."
0,"The class discussions were thought-provoking, but the exams were challenging."
1,I'm amazed at how much I've learned in such a short time. This course was intense but worth it.
-1,I wish the course had more practical applications instead of theory.
0,The course was forgettable. It didn't leave a strong impression on me.
1,I'm impressed by how my perspective has changed after taking this course.
-1,The course was a letdown. The content felt outdated and irrelevant.
1,I thoroughly enjoyed the course. The projects were challenging but fulfilling.
1,I appreciated the hands-on labs and the chance to apply what I learned.
1,The interactive quizzes helped me assess my understanding of the material.
-1,"I had high hopes for this course, but it didn't meet my expectations."
-1,The course was a disappointment. The topics were disjointed and poorly explained.
1,I appreciate the valuable insights I gained from this course.
-1,The course was disappointing. It didn't meet my expectations.
